{
  "$schema": "../../schemas/effect-selection.schema.json",
  "asset_id": "effects:bam:SPCLOUD3",
  "contract": {
    "cycles": [
      {
        "cycle": 0,
        "frame_indices": [
          0,
          1,
          2,
          3,
          4,
          5,
          6,
          7,
          8,
          9,
          10,
          9,
          8,
          7,
          6,
          5,
          4,
          3,
          2,
          1
        ],
        "lookup_start": 0
      }
    ],
    "frame_count": 40,
    "source": {
      "interpolation_run": "spcloud3-interpolation-apollo30-retimed-20261014-v2",
      "interpolation_run_descriptor_sha256": "7543BDF113E93E8DC45CCCD72667AA7E310ADEF8E25C9ACA0060523AE33C5CE0",
      "source_bam_sha256": "869c0ebec02473e2be84ed4412c3957abc4bee967b7b8b0ecad91f613694c7c6",
      "spatial_manifest_sha256": "4CCC7F7A930F02915912BB07227A9FFBE4A6E6BA8F8B69573629FBC04EE8C0A2",
      "spatial_run": "spcloud3-spatial-seedvr7b-lab-lot33-20261014-v1",
      "spatial_run_descriptor_sha256": "82CA4685A90E33AA9E5D7E6D3BE53CBB21083BEAE452B638A84355F62C3045A5"
    },
    "timeline": {
      "native_fps": [
        15,
        1
      ],
      "native_frame_indices": [
        0,
        2,
        4,
        6,
        8,
        10,
        12,
        14,
        16,
        18,
        20,
        22,
        24,
        26,
        28,
        30,
        32,
        34,
        36,
        38
      ],
      "phase_count": 40,
      "target_fps": [
        30,
        1
      ],
      "timeline_frame_indices": [
        0,
        1,
        2,
        3,
        4,
        5,
        6,
        7,
        8,
        9,
        10,
        11,
        12,
        13,
        14,
        15,
        16,
        17,
        18,
        19,
        20,
        21,
        22,
        23,
        24,
        25,
        26,
        27,
        28,
        29,
        30,
        31,
        32,
        33,
        34,
        35,
        36,
        37,
        38,
        39
      ]
    }
  },
  "decision_date": "2026-10-15",
  "mode": "x4",
  "qa_evidence": {
    "bytes": 1549,
    "path": "effects/index/qa-decisions/SPCLOUD3/2026-10-15-accepted-cf845b1a3a34.json",
    "sha256": "CF845B1A3A3463CA8AD81657175C694C22FFE9445C51DF3290E87E46D12051C8"
  },
  "resref": "SPCLOUD3",
  "run_descriptor": {
    "bytes": 2087,
    "path": "effects/ressources/SPCLOUD3/runs/spcloud3-interpolation-apollo30-retimed-20261014-v2/run.json",
    "sha256": "7543BDF113E93E8DC45CCCD72667AA7E310ADEF8E25C9ACA0060523AE33C5CE0"
  },
  "runtime_pack": {
    "manifest": {
      "bytes": 28487,
      "path": "effects/ressources/SPCLOUD3/packs/spcloud3-7b-x4-apollo30-retimed-20261014-v2/manifest.json",
      "sha256": "212B64ECE927B7D6026C43E743A2D313FCD67DD75B8945DE29DA4C32B663C761"
    },
    "registry": {
      "bytes": 624,
      "path": "effects/ressources/SPCLOUD3/packs/spcloud3-7b-x4-apollo30-retimed-20261014-v2/EffectAnimations-X4.registry",
      "sha256": "4AB793F419009B7930E9B44A53F4D728301D036C5429FEDEE9BF41AAAA4387E6"
    },
    "registry_version": 2
  },
  "schema": "bg2-effects-selection-v1",
  "schema_version": 1,
  "selected_run": "spcloud3-interpolation-apollo30-retimed-20261014-v2",
  "source": {
    "bytes": 12542,
    "path": "effects/ressources/SPCLOUD3/source.bam",
    "sha256": "869C0EBEC02473E2BE84ED4412C3957ABC4BEE967B7B8B0ECAD91F613694C7C6"
  }
}
