{
  "$schema": "../../schemas/effect-selection.schema.json",
  "asset_id": "effects:bam:SPUNHOLY",
  "contract": {
    "cycles": [
      {
        "cycle": 0,
        "frame_indices": [
          0,
          1,
          2,
          3,
          4,
          5,
          6,
          7,
          8,
          9,
          10,
          11,
          12,
          13,
          14,
          15,
          16,
          17,
          18,
          19,
          20,
          21,
          22,
          23,
          24,
          25,
          26,
          27,
          28,
          29,
          30,
          31,
          32,
          33,
          34,
          35,
          36,
          37,
          38,
          39,
          40,
          41,
          42,
          43,
          44,
          45,
          46,
          47,
          48,
          49
        ],
        "lookup_start": 0
      }
    ],
    "frame_count": 97,
    "source": {
      "interpolation_run": "spunholy-interpolation-gauss12-feather12-lot54-20261013-v1",
      "interpolation_run_descriptor_sha256": "AE0F58D8AEECE7056BA4679D677C9E772D057DE2AE8375C1B2153600B3E2ECA1",
      "source_bam_sha256": "94d16afdb156863a7ce37f7337b9352d238f6b34eece80523f61ca15a47bf558",
      "spatial_manifest_sha256": "6278C176372845825C333850FE5985259A6E7ED12BB3912D44FA689C61CDB8C7",
      "spatial_run": "spunholy-spatial-seedvr3b-lab-lot54-20261013-v1",
      "spatial_run_descriptor_sha256": "244A078A0D111DDE5F0135607DBE7FBF3C125F4A74A52F54FD56382CCC40F31F"
    },
    "timeline": {
      "native_fps": [
        15,
        1
      ],
      "native_frame_indices": [
        0,
        2,
        4,
        6,
        8,
        10,
        12,
        14,
        16,
        18,
        20,
        22,
        24,
        26,
        28,
        30,
        32,
        34,
        36,
        38,
        40,
        42,
        44,
        46,
        48,
        50,
        52,
        54,
        56,
        58,
        60,
        62,
        64,
        66,
        68,
        70,
        72,
        74,
        76,
        78,
        80,
        82,
        84,
        86,
        88,
        90,
        92,
        94,
        95,
        96
      ],
      "phase_count": 100,
      "target_fps": [
        30,
        1
      ],
      "timeline_frame_indices": [
        0,
        1,
        2,
        3,
        4,
        5,
        6,
        7,
        8,
        9,
        10,
        11,
        12,
        13,
        14,
        15,
        16,
        17,
        18,
        19,
        20,
        21,
        22,
        23,
        24,
        25,
        26,
        27,
        28,
        29,
        30,
        31,
        32,
        33,
        34,
        35,
        36,
        37,
        38,
        39,
        40,
        41,
        42,
        43,
        44,
        45,
        46,
        47,
        48,
        49,
        50,
        51,
        52,
        53,
        54,
        55,
        56,
        57,
        58,
        59,
        60,
        61,
        62,
        63,
        64,
        65,
        66,
        67,
        68,
        69,
        70,
        71,
        72,
        73,
        74,
        75,
        76,
        77,
        78,
        79,
        80,
        81,
        82,
        83,
        84,
        85,
        86,
        87,
        88,
        89,
        90,
        91,
        92,
        93,
        94,
        94,
        95,
        95,
        96,
        96
      ]
    }
  },
  "decision_date": "2026-10-13",
  "mode": "x4",
  "qa_evidence": {
    "bytes": 1108,
    "path": "effects/index/qa-decisions/SPUNHOLY/2026-10-13-accepted-b770b363e880.json",
    "sha256": "B770B363E880B8565DA5781F45CE67097083FD91D79FC03D27457FDC0EA230CB"
  },
  "resref": "SPUNHOLY",
  "run_descriptor": {
    "bytes": 2425,
    "path": "effects/ressources/SPUNHOLY/runs/spunholy-interpolation-gauss12-feather12-lot54-20261013-v1/run.json",
    "sha256": "AE0F58D8AEECE7056BA4679D677C9E772D057DE2AE8375C1B2153600B3E2ECA1"
  },
  "runtime_pack": {
    "manifest": {
      "bytes": 73437,
      "path": "effects/ressources/SPUNHOLY/packs/spunholy-seedvr3b-apollo30-gauss12-feather12-lot54-20261013-v1/manifest.json",
      "sha256": "DD99ED623FEC96CB6D0AFD85A7767D55E036CE9A021003DDB04F32228AD5F82E"
    },
    "registry": {
      "bytes": 1440,
      "path": "effects/ressources/SPUNHOLY/packs/spunholy-seedvr3b-apollo30-gauss12-feather12-lot54-20261013-v1/EffectAnimations-X4.registry",
      "sha256": "2605AAC9C330BBAC38C90F55F156FB30FBD2DB69A1CDD3CE5F3ACEC7642288D7"
    },
    "registry_version": 2
  },
  "schema": "bg2-effects-selection-v1",
  "schema_version": 1,
  "selected_run": "spunholy-interpolation-gauss12-feather12-lot54-20261013-v1",
  "source": {
    "bytes": 42242,
    "path": "effects/ressources/SPUNHOLY/source.bam",
    "sha256": "94D16AFDB156863A7CE37F7337B9352D238F6B34EECE80523F61CA15A47BF558"
  }
}
